{
  "schema_version": "0.3.0",
  "document_type": "asset_class_dictionary",
  "generated_at": "2026-08-06T18:51:57Z",
  "source_document": "Homestead_Digital_Twin_Software_Design_Document_v0.2.md",
  "domains": {
    "site": "Property-wide objects, geographic sectors, weather and shared state.",
    "structure": "Buildings, containers, rooms, enclosures, roof areas and service spaces.",
    "energy": "Generation, storage, conversion, distribution, metering and loads.",
    "water": "Well, potable water, rainwater, graywater, irrigation and process water.",
    "agriculture": "Orchard, food forest, greenhouse, compost, crops, soil and biological assets.",
    "storage": "Food storage, nitrogen displacement, dry storage, cold storage and inventory.",
    "spa": "Hydrothermal pavilion water, thermal, sanitation and humidity systems.",
    "it": "Servers, storage, network, telephony, applications and platform services.",
    "security": "Cameras, access control, gates, doors, perimeter and alarm devices.",
    "workshop": "Tools, machinery, fabrication equipment, consumables and shop utilities.",
    "fuel": "Generator fuel, synthetic fuel, gas storage and future Aircela integration.",
    "safety": "Fire, smoke, leak, emergency-stop, hazardous-atmosphere and emergency systems."
  },
  "lifecycle_statuses": [
    "concept",
    "planned",
    "procured",
    "installed",
    "commissioned",
    "active",
    "degraded",
    "failed",
    "maintenance",
    "reserve",
    "retired"
  ],
  "criticality_levels": [
    "life_safety",
    "critical",
    "important",
    "discretionary"
  ],
  "control_authorities": [
    "none",
    "manual",
    "local_only",
    "vendor_native",
    "supervisory",
    "local_controller_with_supervisory_setpoints",
    "safety_interlock"
  ],
  "relationship_types": {
    "contains": "Physical or logical containment.",
    "located_in": "Geographic or structural location.",
    "feeds": "Supplies energy, water, data or material.",
    "returns_to": "Return path.",
    "controls": "Controller owns a process output.",
    "monitors": "Sensor or service observes an asset.",
    "protects": "Protection device acts on equipment.",
    "depends_on": "Operational dependency.",
    "backs_up": "Redundant or alternate resource.",
    "measures": "Meter or sensor association.",
    "serves": "Utility or service supports an end-use system.",
    "part_of": "Functional grouping.",
    "associated_with": "Non-flow contextual link.",
    "replaces": "Asset lifecycle succession.",
    "connected_to": "Physical or logical connectivity where a directional flow is not asserted.",
    "hosts": "Compute or enclosure asset hosts a software service or virtualized asset.",
    "managed_by": "Device is managed by a controller or management service."
  },
  "asset_classes": {
    "site": {
      "purpose": "Entire property.",
      "allowed_domains": [
        "site"
      ],
      "required_properties": [
        "timezone",
        "boundary_status"
      ],
      "default_points": [
        "mode_actual",
        "alarm_summary",
        "occupancy_state"
      ],
      "source_section": "27.1",
      "dictionary_status": "baseline_v0_2"
    },
    "geographic_zone": {
      "purpose": "Managed land area.",
      "allowed_domains": [
        "site",
        "agriculture"
      ],
      "required_properties": [
        "land_use",
        "geometry_status"
      ],
      "default_points": [
        "status_condition",
        "accessibility_state"
      ],
      "source_section": "27.1",
      "dictionary_status": "baseline_v0_2"
    },
    "structure": {
      "purpose": "Building or container.",
      "allowed_domains": [
        "structure"
      ],
      "required_properties": [
        "structure_type",
        "envelope_status"
      ],
      "default_points": [
        "temperature_air_c",
        "humidity_relative_pct",
        "door_state",
        "leak_active"
      ],
      "source_section": "27.1",
      "dictionary_status": "baseline_v0_2"
    },
    "room": {
      "purpose": "Interior operational space.",
      "allowed_domains": [
        "structure"
      ],
      "required_properties": [
        "environmental_class"
      ],
      "default_points": [
        "temperature_air_c",
        "humidity_relative_pct",
        "occupancy_state"
      ],
      "source_section": "27.1",
      "dictionary_status": "baseline_v0_2"
    },
    "enclosure": {
      "purpose": "Cabinet, rack, battery bay, or control panel.",
      "allowed_domains": [
        "structure",
        "energy",
        "it"
      ],
      "required_properties": [
        "ingress_rating_status",
        "access_method"
      ],
      "default_points": [
        "temperature_air_c",
        "door_state",
        "smoke_active"
      ],
      "source_section": "27.1",
      "dictionary_status": "baseline_v0_2"
    },
    "pv_array": {
      "purpose": "Group of photovoltaic rows or strings.",
      "allowed_domains": [
        "energy"
      ],
      "required_properties": [
        "rated_kwdc",
        "orientation",
        "tilt_deg"
      ],
      "default_points": [
        "power_dc_kw",
        "energy_today_kwh",
        "solar_irradiance_w_m2",
        "availability_state"
      ],
      "source_section": "27.2",
      "dictionary_status": "baseline_v0_2"
    },
    "pv_row": {
      "purpose": "Physical agrivoltaic canopy row.",
      "allowed_domains": [
        "energy"
      ],
      "required_properties": [
        "module_count",
        "module_rating_w",
        "orientation",
        "tilt_deg"
      ],
      "default_points": [
        "power_dc_kw",
        "availability_state"
      ],
      "source_section": "Agrivoltaic diagram",
      "dictionary_status": "reconciled_v0_3",
      "notes": "Physical row identity; electrical string topology remains a separate design field."
    },
    "pv_string": {
      "purpose": "Electrical PV string.",
      "allowed_domains": [
        "energy"
      ],
      "required_properties": [
        "module_count",
        "voc_design_v",
        "isc_design_a"
      ],
      "default_points": [
        "voltage_dc_v",
        "current_dc_a",
        "power_dc_kw",
        "fault_active"
      ],
      "source_section": "27.2",
      "dictionary_status": "baseline_v0_2"
    },
    "combiner": {
      "purpose": "PV or AC collection and protection assembly.",
      "allowed_domains": [
        "energy"
      ],
      "required_properties": [
        "combiner_type",
        "input_count"
      ],
      "default_points": [
        "current_total_a",
        "door_state",
        "temperature_air_c",
        "fault_active"
      ],
      "source_section": "27.2",
      "dictionary_status": "baseline_v0_2"
    },
    "disconnect": {
      "purpose": "Electrical isolation device.",
      "allowed_domains": [
        "energy"
      ],
      "required_properties": [
        "disconnect_type",
        "rated_voltage_v",
        "rated_current_a"
      ],
      "default_points": [
        "state_operating",
        "open_state",
        "fault_active"
      ],
      "source_section": "system diagrams",
      "dictionary_status": "reconciled_v0_3"
    },
    "inverter": {
      "purpose": "DC/AC conversion and charging.",
      "allowed_domains": [
        "energy"
      ],
      "required_properties": [
        "rated_power_kw",
        "topology"
      ],
      "default_points": [
        "power_ac_output_kw",
        "power_dc_input_kw",
        "voltage_ac_v",
        "frequency_hz",
        "state_operating",
        "fault_code"
      ],
      "source_section": "27.2",
      "dictionary_status": "baseline_v0_2"
    },
    "battery_bank": {
      "purpose": "Site energy storage.",
      "allowed_domains": [
        "energy"
      ],
      "required_properties": [
        "nominal_capacity_kwh",
        "usable_capacity_kwh",
        "chemistry"
      ],
      "default_points": [
        "soc_pct",
        "soh_pct",
        "power_kw",
        "energy_available_kwh",
        "temperature_cell_max_c",
        "charge_limit_kw",
        "discharge_limit_kw"
      ],
      "source_section": "27.2",
      "dictionary_status": "baseline_v0_2"
    },
    "battery_module": {
      "purpose": "Serviceable battery unit.",
      "allowed_domains": [
        "energy"
      ],
      "required_properties": [
        "chemistry",
        "capacity_kwh"
      ],
      "default_points": [
        "voltage_v",
        "temperature_cell_max_c",
        "soc_pct",
        "fault_code"
      ],
      "source_section": "27.2",
      "dictionary_status": "baseline_v0_2"
    },
    "bms": {
      "purpose": "Battery-management controller.",
      "allowed_domains": [
        "energy"
      ],
      "required_properties": [
        "protected_asset_ids"
      ],
      "default_points": [
        "state_operating",
        "charge_permissive",
        "discharge_permissive",
        "contactor_state"
      ],
      "source_section": "27.2",
      "dictionary_status": "baseline_v0_2"
    },
    "generator": {
      "purpose": "Backup generation.",
      "allowed_domains": [
        "energy",
        "fuel"
      ],
      "required_properties": [
        "fuel_type",
        "rated_power_kw"
      ],
      "default_points": [
        "state_operating",
        "power_output_kw",
        "fuel_level_pct",
        "runtime_total_h",
        "start_failure_active"
      ],
      "source_section": "27.2",
      "dictionary_status": "baseline_v0_2"
    },
    "ats": {
      "purpose": "Automatic transfer switch.",
      "allowed_domains": [
        "energy"
      ],
      "required_properties": [
        "source_a_id",
        "source_b_id"
      ],
      "default_points": [
        "source_selected",
        "source_a_available",
        "source_b_available",
        "transfer_total"
      ],
      "source_section": "27.2",
      "dictionary_status": "baseline_v0_2"
    },
    "panel": {